title,publication_date,citations,date,year,month,field,subfield,topics,main_writer,all_writers,author_ids
FedMultimodal: A Benchmark for Multimodal Federated Learning,2023-08-04,0,2023-08-04,2023,8,Computer Science,Artificial Intelligence,"['Privacy-Preserving Technologies in Data', 'Mobile Crowdsensing and Crowdsourcing']",Tuo Zhang,"['Tuo Zhang', 'Rahul Gupta', 'Mi Zhang', 'Shrikanth Narayanan']","['https://openalex.org/A5029803129', 'https://openalex.org/A5075937808', 'https://openalex.org/A5100659123', 'https://openalex.org/A5010028928']"
Red-flag signs and symptoms for earlier diagnosis of early-onset colorectal cancer,2023-05-04,0,2023-05-04,2023,5,Medicine,Oncology,"['Colorectal Cancer Screening and Detection', 'Genetic factors in colorectal cancer', 'Gastric Cancer Management and Outcomes']",Yin Cao,"['Samir Gupta', 'Yin Cao']","['https://openalex.org/A5060332126', 'https://openalex.org/A5034083482']"
"Lisocabtagene Maraleucel in Relapsed/Refractory Mantle Cell Lymphoma: Primary Analysis of the Mantle Cell Lymphoma Cohort From TRANSCEND NHL 001, a Phase I Multicenter Seamless Design Study",2023-12-11,0,2023-12-11,2023,12,Medicine,Oncology,"['CAR-T cell therapy research', 'Lymphoma Diagnosis and Treatment', 'Cutaneous lymphoproliferative disorders research']",Michael Wang,"['Michael Wang', 'Tanya Siddiqi', 'Leo I. Gordon', 'Manali Kamdar', 'Matthew A. Lunning', 'Jeremy S. Abramson', 'Nilanjan Ghosh', 'Amitkumar Mehta', 'Charalambos Andreadis', 'Scott R. Solomon', 'M. Lia Palomba']","['https://openalex.org/A5100438316', 'https://openalex.org/A5005565037', 'https://openalex.org/A5010130956', 'https://openalex.org/A5000537427', 'https://openalex.org/A5088179815', 'https://openalex.org/A5002103749', 'https://openalex.org/A5074766331', 'https://openalex.org/A5030631799', 'https://openalex.org/A5068715900', 'https://openalex.org/A5006999192', 'https://openalex.org/A5052659722']"
Repurposing Approved Drugs for Sarcopenia Based on Transcriptomics Data in Humans,2023-04-18,0,2023-04-18,2023,4,"Biochemistry, Genetics and Molecular Biology",Molecular Biology,"['Muscle Physiology and Disorders', 'Nutrition and Health in Aging', 'GDF15 and Related Biomarkers']",Shuang Liang,"['Shuang Liang', 'Hui Shen', 'Hong‐Wen Deng']","['https://openalex.org/A5085963520', 'https://openalex.org/A5013518217', 'https://openalex.org/A5024194480']"
"Water Recycling in the Deep Earth: Insights From Integrated μ‐XRF, THz‐TDS Spectroscopy, TG, and DCS of High‐Pressure Granulite",2023-02-25,0,2023-02-25,2023,2,Earth and Planetary Sciences,Geophysics,"['Geological and Geochemical Analysis', 'High-pressure geophysics and materials', 'Geochemistry and Geologic Mapping']",Shanshan Li,"['Shanshan Li', 'Zhiyuan Zheng']","['https://openalex.org/A5100371501', 'https://openalex.org/A5079020684']"
"Depression pathophysiology, risk prediction of recurrence and comorbid psychiatric disorders using genome-wide analyses",2023-07-01,0,2023-07-01,2023,7,"Biochemistry, Genetics and Molecular Biology",Genetics,"['Genetic Associations and Epidemiology', 'Genetics and Neurodevelopmental Disorders', 'Epigenetics and DNA Methylation']",Mitja Kurki,"['Mitja Kurki', 'Jakob Grove', 'Georgios Voloudakis', 'Daniel F. Levey', 'Jaroslav Bendl', 'Jonas Bybjerg‐Grauholm', 'Ditte Demontis', 'Hreinn Stefánsson', 'Bjarni J. Vilhjálmsson', 'Esben Agerbo', 'Kāri Stefánsson', 'Merete Nordentoft', 'Thomas Werge', 'David M. Hougaard', 'Preben Bo Mortensen', 'Murray B. Stein', 'Joel Gelernter', 'Panos Roussos', 'Mark J. Daly', 'Ole Mors', 'Aarno Palotie', 'Anders D. Børglum']","['https://openalex.org/A5017396611', 'https://openalex.org/A5049442241', 'https://openalex.org/A5037342798', 'https://openalex.org/A5002249552', 'https://openalex.org/A5054767604', 'https://openalex.org/A5052121197', 'https://openalex.org/A5014114792', 'https://openalex.org/A5009208804', 'https://openalex.org/A5078389898', 'https://openalex.org/A5051686843', 'https://openalex.org/A5018239255', 'https://openalex.org/A5036554086', 'https://openalex.org/A5051228367', 'https://openalex.org/A5081337637', 'https://openalex.org/A5016739507', 'https://openalex.org/A5074969156', 'https://openalex.org/A5044047568', 'https://openalex.org/A5074488210', 'https://openalex.org/A5107596541', 'https://openalex.org/A5015327943', 'https://openalex.org/A5085708490', 'https://openalex.org/A5035161779']"
Oesophageal cancer,2024-11-01,0,2024-11-01,2024,11,Medicine,Surgery,"['Esophageal Cancer Research and Treatment', 'Gastric Cancer Management and Outcomes', 'Esophageal and GI Pathology']",Hong Yang,"['Hong Yang', 'Feng Wang', 'J. Fu']","['https://openalex.org/A5109592362', 'https://openalex.org/A5072296344', 'https://openalex.org/A5042580362']"
Suppression of food intake by Glp1r/Lepr-coexpressing neurons prevents obesity in mouse models,2023-08-15,0,2023-08-15,2023,8,Neuroscience,Endocrine and Autonomic Systems,"['Regulation of Appetite and Obesity', 'Biochemical Analysis and Sensing Techniques', 'Adipose Tissue and Metabolism']",Randy J. Seeley,"['Randy J. Seeley', 'Paul Kievit']","['https://openalex.org/A5065488328', 'https://openalex.org/A5005189935']"
"Atezolizumab, venetoclax, and obinutuzumab combination in Richter transformation diffuse large B-cell lymphoma (MOLTO): a multicentre, single-arm, phase 2 trial",2024-09-10,0,2024-09-10,2024,9,Medicine,Pathology and Forensic Medicine,"['Lymphoma Diagnosis and Treatment', 'Chronic Lymphocytic Leukemia Research', 'CAR-T cell therapy research']",Alessandra Tedeschi,"['Alessandra Tedeschi', 'Pier Luigi Zinzani']","['https://openalex.org/A5008054206', 'https://openalex.org/A5091882595']"
Genomic medicine to reduce tobacco and related disorders: Translation to precision prevention and treatment,2023-04-01,0,2023-04-01,2023,4,Medicine,Physiology,"['Smoking Behavior and Cessation', 'Genetic Associations and Epidemiology', 'BRCA gene mutations in cancer']",Timothy R. Baker,"['Timothy R. Baker', 'Christopher I. Amos', 'Laura J. Bierut']","['https://openalex.org/A5103060749', 'https://openalex.org/A5028989565', 'https://openalex.org/A5077159635']"
Information Technology Innovativeness and Data-Breach Risk: A Longitudinal Study,2023-10-02,0,2023-10-02,2023,10,Computer Science,Information Systems,"['Information and Cyber Security', 'Supply Chain Resilience and Risk Management', 'Information Technology Governance and Strategy']",Qian Wang,"['Qian Wang', 'Jason Bennett Thatcher']","['https://openalex.org/A5100391023', 'https://openalex.org/A5028695671']"
Deploying solar photovoltaic energy first in carbon-intensive regions brings gigatons more carbon mitigations to 2060,2023-10-11,0,2023-10-11,2023,10,Environmental Science,Environmental Engineering,"['Environmental Impact and Sustainability', 'Photovoltaic Systems and Sustainability', 'Climate Change Policy and Economics']",Shi Chen,"['Shi Chen', 'Xi Lu', 'Fang Zhang', 'Jiming Hao']","['https://openalex.org/A5100362187', 'https://openalex.org/A5005558847', 'https://openalex.org/A5092095409', 'https://openalex.org/A5105231704']"
Functional connectivity MRI provides an imaging correlate for chimeric antigen receptor T-cell-associated neurotoxicity,2023-01-01,0,2023-01-01,2023,1,Medicine,Neurology,"['CNS Lymphoma Diagnosis and Treatment', 'Glioma Diagnosis and Treatment', 'Cancer-related cognitive impairment studies']",Philipp Karschnia,"['Philipp Karschnia', 'Kai Rejeski', 'Christian Schmidt', 'Hesheng Liu', 'Marion Subklewe']","['https://openalex.org/A5036243661', 'https://openalex.org/A5054210888', 'https://openalex.org/A5083564501', 'https://openalex.org/A5061226868', 'https://openalex.org/A5107944238']"
Intrafusal-fiber LRP4 for muscle spindle formation and maintenance in adult and aged animals,2023-02-10,0,2023-02-10,2023,2,"Biochemistry, Genetics and Molecular Biology",Molecular Biology,"['Muscle Physiology and Disorders', ""Children's Physical and Motor Development"", 'Genetic Neurodegenerative Diseases']",Peng Chen,"['Peng Chen', 'Hongsheng Wang', 'Bin Luo', 'Yu Zheng', 'Wen‐Cheng Xiong']","['https://openalex.org/A5100338462', 'https://openalex.org/A5100773097', 'https://openalex.org/A5049769125', 'https://openalex.org/A5056185631', 'https://openalex.org/A5065643695']"
A human antibody epitope map of Pfs230D1 derived from analysis of individuals vaccinated with a malaria transmission-blocking vaccine,2023-02-01,0,2023-02-01,2023,2,Medicine,"Public Health, Environmental and Occupational Health","['Malaria Research and Control', 'vaccines and immunoinformatics approaches', 'HIV Research and Treatment']",Patrick E. Duffy,"['Kazutoyo Miura', 'Carole A. Long', 'Patrick E. Duffy', 'Niraj H. Tolia']","['https://openalex.org/A5089823757', 'https://openalex.org/A5028156362', 'https://openalex.org/A5049967604', 'https://openalex.org/A5083532553']"
FSMFA: Efficient firmware-secure multi-factor authentication protocol for IoT devices,2023-01-09,0,2023-01-09,2023,1,Computer Science,Computer Networks and Communications,"['Advanced Authentication Protocols Security', 'User Authentication and Security Systems', 'Physical Unclonable Functions (PUFs) and Hardware Security']",Yuhong Liu,"['Yuhong Liu', 'Long Chen']","['https://openalex.org/A5100324600', 'https://openalex.org/A5100336427']"
Driver lines for studying associative learning in Drosophila,2023-09-16,0,2023-09-16,2023,9,Neuroscience,Cellular and Molecular Neuroscience,"['Neurobiology and Insect Physiology Research', 'Plant Molecular Biology Research', 'Animal Behavior and Reproduction']",Igor Siwanowicz,"['Igor Siwanowicz', 'Gerald M. Rubin', 'Glenn Turner']","['https://openalex.org/A5026517084', 'https://openalex.org/A5086255792', 'https://openalex.org/A5067236341']"
LINKER-MM1 study: Linvoseltamab (REGN5458) in patients with relapsed/refractory multiple myeloma.,2023-06-01,0,2023-06-01,2023,6,Medicine,Hematology,"['Multiple Myeloma Research and Treatments', 'Monoclonal and Polyclonal Antibodies Research', 'Cancer Treatment and Pharmacology']",Hans C. Lee,"['Hans C. Lee', 'Joshua Richter', 'Madhav V. Dhodapkar', 'Attaya Suvannasankha', 'Suzanne Lentzsch', 'Sundar Jagannath']","['https://openalex.org/A5048362577', 'https://openalex.org/A5030703994', 'https://openalex.org/A5088696429', 'https://openalex.org/A5052787074', 'https://openalex.org/A5031344736', 'https://openalex.org/A5028046297']"
Learning Closed-form Equations for Subgrid-scale Closures from High-fidelity Data: Promises and Challenges,2023-06-14,0,2023-06-14,2023,6,Environmental Science,Global and Planetary Change,"['Climate variability and models', 'Meteorological Phenomena and Simulations', 'Hydrocarbon exploration and reservoir analysis']",Pedram Hassanzadeh,"['Pedram Hassanzadeh', 'Laure Zanna']","['https://openalex.org/A5052673105', 'https://openalex.org/A5032073724']"
A Dual-Augmentor Framework for Domain Generalization in 3D Human Pose Estimation,2024-06-16,0,2024-06-16,2024,6,Computer Science,Computer Vision and Pattern Recognition,"['Human Pose and Action Recognition', 'Gait Recognition and Analysis', 'Anomaly Detection Techniques and Applications']",Ce Zheng,"['Ce Zheng', 'Chen Chen']","['https://openalex.org/A5051880074', 'https://openalex.org/A5100418568']"
Genomes to Fields 2022 Maize genotype by Environment Prediction Competition,2023-07-17,0,2023-07-17,2023,7,Agricultural and Biological Sciences,Plant Science,"['Genetics and Plant Breeding', 'Genetic Mapping and Diversity in Plants and Animals']",Edward S. Buckler,"['Edward S. Buckler', 'Sherry Flint‐Garcia', 'Seth C. Murray', 'James C. Schnable', 'Addie Thompson']","['https://openalex.org/A5020150778', 'https://openalex.org/A5061885595', 'https://openalex.org/A5075745841', 'https://openalex.org/A5108850976', 'https://openalex.org/A5114067196']"
Hallmarks of CD8+ T cell dysfunction are established within hours of tumor antigen encounter before cell division,2023-08-03,0,2023-08-03,2023,8,Immunology and Microbiology,Immunology,"['Immune Cell Function and Interaction', 'Cancer Immunotherapy and Biomarkers', 'T-cell and B-cell Immunology']",Paul Zumbo,"['Paul Zumbo', 'Doron Betel']","['https://openalex.org/A5031892664', 'https://openalex.org/A5072909840']"
Cardiovascular Significance and Genetics of Epicardial and Pericardial Adiposity,2024-03-13,0,2024-03-13,2024,3,Medicine,Cardiology and Cardiovascular Medicine,"['Cardiovascular Disease and Adiposity', 'Cardiovascular, Neuropeptides, and Oxidative Stress Research', 'Cardiovascular Function and Risk Factors']",Joel Rämö,"['Joel Rämö', 'Shinwan Kany', 'Samuel Friedman', 'Satoshi Koyama', 'Juha Karjalainen', 'Aarno Palotie', 'Patrick T. Ellinor', 'James P. Pirruccello']","['https://openalex.org/A5044378355', 'https://openalex.org/A5020324180', 'https://openalex.org/A5054879244', 'https://openalex.org/A5010690225', 'https://openalex.org/A5112934027', 'https://openalex.org/A5085708490', 'https://openalex.org/A5069822855', 'https://openalex.org/A5014525847']"
Measurements of neutrino oscillation parameters from the T2K experiment using $$3.6\times 10^{21}$$ protons on target,2023-09-05,0,2023-09-05,2023,9,Physics and Astronomy,Nuclear and High Energy Physics,"['Neutrino Physics Research', 'Particle physics theoretical and experimental studies', 'Astrophysics and Cosmic Phenomena']",K. Abe,"['K. Abe', 'Yosuke Ashida', 'G. Barr', 'G. Collazuol', 'A. De Roeck', 'G. De Rosa', 'O. Drapier', 'G. Fiorillo', 'M. Friend']","['https://openalex.org/A5101884633', 'https://openalex.org/A5060636446', 'https://openalex.org/A5019047837', 'https://openalex.org/A5102845224', 'https://openalex.org/A5105789764', 'https://openalex.org/A5050570144', 'https://openalex.org/A5107934772', 'https://openalex.org/A5008414471', 'https://openalex.org/A5105574054']"
Long-term exposure to ambient fine particulate components and leukocyte epigenome-wide DNA Methylation in older men: the Normative Aging Study,2023-08-07,0,2023-08-07,2023,8,Environmental Science,"Health, Toxicology and Mutagenesis","['Air Quality and Health Impacts', 'Energy and Environment Impacts', 'Epigenetics and DNA Methylation']",Heresh Amini,"['Heresh Amini', 'Yaguang Wei', 'Lifang Hou', 'Yinan Zheng', 'Brent A. Coull', 'Andrea Baccarelli', 'Joel Schwartz']","['https://openalex.org/A5039033866', 'https://openalex.org/A5030834671', 'https://openalex.org/A5012727097', 'https://openalex.org/A5044839854', 'https://openalex.org/A5045303930', 'https://openalex.org/A5069636788', 'https://openalex.org/A5046557560']"
Sample size requirements are not being considered in studies developing prediction models for binary outcomes: a systematic review,2023-08-19,0,2023-08-19,2023,8,Decision Sciences,"Statistics, Probability and Uncertainty","['Meta-analysis and systematic reviews', 'Statistical Methods in Epidemiology', 'Sepsis Diagnosis and Treatment']",Paula Dhiman,"['Paula Dhiman', 'Jie Ma', 'Garrett S. Bullock', 'Richard D. Riley', 'Gary S. Collins']","['https://openalex.org/A5059901188', 'https://openalex.org/A5033683284', 'https://openalex.org/A5021600953', 'https://openalex.org/A5040942978', 'https://openalex.org/A5060891981']"
"Maximizing efficiency in solar ammonia–water absorption refrigeration cycles: Exergy analysis, concentration impact, and advanced optimization with GBRT machine learning and FHO optimizer",2024-01-30,0,2024-01-30,2024,1,Engineering,Mechanical Engineering,"['Thermodynamic and Exergetic Analyses of Power and Cooling Systems', 'Adsorption and Cooling Systems', 'Thermal Radiation and Cooling Technologies']",Raed Al-Rbaihat,"['Raed Al-Rbaihat', 'Hussein Alahmer', 'Mohammad Alrbai', 'Ali Alahmer']","['https://openalex.org/A5027632727', 'https://openalex.org/A5089015021', 'https://openalex.org/A5074956236', 'https://openalex.org/A5064059746']"
Transparent medical image AI via an image–text foundation model grounded in medical literature,2024-04-01,0,2024-04-01,2024,4,Computer Science,Artificial Intelligence,"['AI in cancer detection', 'Cutaneous Melanoma Detection and Management', 'Colorectal Cancer Screening and Detection']",Roxana Daneshjou,"['Roxana Daneshjou', 'Su‐In Lee']","['https://openalex.org/A5014300312', 'https://openalex.org/A5028723221']"
"Trends in electronic structures and <mml:math xmlns:mml=""http://www.w3.org/1998/Math/MathML""><mml:msub><mml:mi>s</mml:mi><mml:mo>±</mml:mo></mml:msub></mml:math> -wave pairing for the rare-earth series in bilayer nickelate superconductor <mml:math xmlns:mml=""http://www.w3.org/1998/Math/MathML""><mml:mrow><mml:msub><mml:mi>R</mml:mi><mml:mn>3</mml:mn></mml:msub><mml:msub><mml:mi>Ni</mml:mi><mml:mn>2</mml:mn></mml:msub><mml:msub><mml:mi mathvariant=""normal"">O</mml:mi><mml:mn>7</mml:mn></mml:msub…",2023-10-23,0,2023-10-23,2023,10,Materials Science,"Electronic, Optical and Magnetic Materials","['Iron-based superconductors research', 'Advanced Condensed Matter Physics', 'Magnetic and transport properties of perovskites and related materials']",Yang Zhang,"['Yang Zhang', 'Thomas Maier', 'Elbio Dagotto']","['https://openalex.org/A5100354805', 'https://openalex.org/A5066143236', 'https://openalex.org/A5047251521']"
The Panchromatic Hubble Andromeda Treasury. XXI. The Legacy Resolved Stellar Photometry Catalog,2023-09-22,0,2023-09-22,2023,9,Physics and Astronomy,Astronomy and Astrophysics,"['Stellar, planetary, and galactic studies', 'CCD and CMOS Imaging Sensors', 'Gamma-ray bursts and supernovae']",Benjamin F. Williams,"['Benjamin F. Williams', 'Dustin Lang', 'Julianne J. Dalcanton', 'Andrew E. Dolphin', 'Daniel R. Weisz', 'Eric F. Bell', 'Karl D. Gordon', 'Puragra Guhathakurta', 'Anil C. Seth']","['https://openalex.org/A5027159284', 'https://openalex.org/A5005412703', 'https://openalex.org/A5083249765', 'https://openalex.org/A5035461563', 'https://openalex.org/A5042006626', 'https://openalex.org/A5047186596', 'https://openalex.org/A5051018099', 'https://openalex.org/A5051126966', 'https://openalex.org/A5078233989']"
Evaluating the spatial patterns of U.S. urban NOx emissions using TROPOMI NO2,2023-11-18,0,2023-11-18,2023,11,Environmental Science,"Health, Toxicology and Mutagenesis","['Air Quality and Health Impacts', 'Atmospheric chemistry and aerosols', 'Vehicle emissions and performance']",Siqi Ma,"['Siqi Ma', 'Arlene M. Fiore', 'Susan C. Anenberg']","['https://openalex.org/A5076961255', 'https://openalex.org/A5028518380', 'https://openalex.org/A5040125395']"
"Effectiveness of Booster Doses of Monovalent mRNA COVID-19 Vaccine Against Symptomatic Severe Acute Respiratory Syndrome Coronavirus 2 Infection in Children, Adolescents, and Adults During Omicron Subvariant BA.2/BA.2.12.1 and BA.4/BA.5 Predominant Periods",2023-04-13,0,2023-04-13,2023,4,Medicine,Infectious Diseases,"['SARS-CoV-2 and COVID-19 Research', 'Viral gastroenteritis research and epidemiology', 'Animal Virus Infections Studies']",Ruth Link‐Gelles,"['Ryan E. Wiegand', 'Zachary Smith', 'Katherine E. Fleming-Dutra', 'Jennifer R. Verani', 'Tamara Pilishvili', 'Ruth Link‐Gelles']","['https://openalex.org/A5020947008', 'https://openalex.org/A5034893026', 'https://openalex.org/A5024358117', 'https://openalex.org/A5087653992', 'https://openalex.org/A5064280673', 'https://openalex.org/A5020614173']"
Long-term treatment outcomes and safety of dupilumab as a therapy for bullous pemphigoid: A multicenter retrospective review,2023-04-26,0,2023-04-26,2023,4,Medicine,Pathology and Forensic Medicine,"['Autoimmune Bullous Skin Diseases', 'Coagulation, Bradykinin, Polyphosphates, and Angioedema', 'Urticaria and Related Conditions']",David Rosmarin,"['Jun Lü', 'David Rosmarin']","['https://openalex.org/A5062089486', 'https://openalex.org/A5008473117']"
A novel NH2-MIL-125/dandelion-like MnO2 nanosphere composite with a rapid interfacial electron transfer pathway for photocatalytic degradation of ornidazole,2024-05-23,0,2024-05-23,2024,5,Energy,"Renewable Energy, Sustainability and the Environment","['Advanced Photocatalysis Techniques', 'Metal-Organic Frameworks: Synthesis and Applications', 'Advanced Nanomaterials in Catalysis']",Chaudhery Mustansar Hussain,"['Rohit Kumar', 'Sonu Sonu', 'Naveen Kumar', 'Tansir Ahamad', 'Chaudhery Mustansar Hussain', 'Pardeep Singh', 'Pankaj Raizada']","['https://openalex.org/A5060473728', 'https://openalex.org/A5008445464', 'https://openalex.org/A5005212578', 'https://openalex.org/A5080595139', 'https://openalex.org/A5006203414', 'https://openalex.org/A5090456927', 'https://openalex.org/A5004260380']"
Anti-cancer properties of boswellic acids: mechanism of action as anti-cancerous agent,2023-08-03,0,2023-08-03,2023,8,Medicine,Pharmacology,['Pharmacological Effects of Medicinal Plants'],Javad Sharifi‐Rad,"['William N. Setzer', 'Javad Sharifi‐Rad']","['https://openalex.org/A5040005212', 'https://openalex.org/A5042251272']"
Biochar modulating soil biological health: A review,2023-12-27,0,2023-12-27,2023,12,Agricultural and Biological Sciences,Soil Science,"['Soil Carbon and Nitrogen Dynamics', 'Microbial Community Ecology and Physiology', 'Clay minerals and soil interactions']",Shiv Bolan,"['Shiv Bolan', 'Manish Kumar', 'Scott X. Chang', 'Deyi Hou', 'Jörg Rinklebe', 'Hailong Wang', 'Kadambot H. M. Siddique', 'M.B. Kirkham', 'Nanthi Bolan']","['https://openalex.org/A5016513822', 'https://openalex.org/A5037280007', 'https://openalex.org/A5086611360', 'https://openalex.org/A5065266286', 'https://openalex.org/A5039520570', 'https://openalex.org/A5100367752', 'https://openalex.org/A5082109205', 'https://openalex.org/A5008744466', 'https://openalex.org/A5007065483']"
"ZUMA-22: A phase 3, randomized controlled study of axicabtagene ciloleucel (axi-cel) versus standard-of-care therapy in patients with relapsed or refractory (R/R) follicular lymphoma (FL).",2023-06-01,0,2023-06-01,2023,6,Medicine,Oncology,"['CAR-T cell therapy research', 'Lymphoma Diagnosis and Treatment', 'Cancer Immunotherapy and Biomarkers']",Ian W. Flinn,"['Ian W. Flinn', 'Caron A. Jacobson', 'Loretta J. Nastoupil', 'Franck Morschhauser', 'Ran Reshef', 'Wei Xue', 'Christina To']","['https://openalex.org/A5000959540', 'https://openalex.org/A5037526878', 'https://openalex.org/A5037878906', 'https://openalex.org/A5051605599', 'https://openalex.org/A5085167557', 'https://openalex.org/A5100422542', 'https://openalex.org/A5080227134']"
Flexible Electrodes for Brain–Computer Interface System,2023-05-05,0,2023-05-05,2023,5,Neuroscience,Cellular and Molecular Neuroscience,"['Neuroscience and Neural Engineering', 'EEG and Brain-Computer Interfaces', 'Advanced Memory and Neural Computing']",Junjie Wang,"['Junjie Wang', 'Kun Wang', 'Peng Li', 'Wei Huang']","['https://openalex.org/A5100395804', 'https://openalex.org/A5073293117', 'https://openalex.org/A5100432721', 'https://openalex.org/A5100352881']"
Search for dark photons with the FASER detector at the LHC,2023-12-07,0,2023-12-07,2023,12,Physics and Astronomy,Nuclear and High Energy Physics,"['Dark Matter and Cosmic Phenomena', 'Particle physics theoretical and experimental studies', 'Particle Detector Development and Performance']",H. Abreu,"['H. Abreu', 'J. K. Anders', 'C. Antel', 'X. Chen', 'Jonathan L. Feng', 'S. M. Gibson', 'Felix Kling', 'L. J. Levinson', 'K. Li', 'Di Wang']","['https://openalex.org/A5039017444', 'https://openalex.org/A5076075206', 'https://openalex.org/A5101979585', 'https://openalex.org/A5064289460', 'https://openalex.org/A5010493054', 'https://openalex.org/A5050296510', 'https://openalex.org/A5086121104', 'https://openalex.org/A5005807071', 'https://openalex.org/A5105508680', 'https://openalex.org/A5080979477']"
Fractional Flow Reserve–Guided PCI or Coronary Bypass Surgery for 3-Vessel Coronary Artery Disease: 3-Year Follow-Up of the FAME 3 Trial,2023-08-21,0,2023-08-21,2023,8,Medicine,Surgery,"['Coronary Interventions and Diagnostics', 'Antiplatelet Therapy and Cardiovascular Diseases', 'Cardiac Imaging and Diagnostics']",William F. Fearon,"['Evald Høj Christiansen', 'Michael J. Reardon', 'Kenneth W. Mahaffey', 'Y. Joseph Woo', 'Bernard De Bruyne', 'William F. Fearon']","['https://openalex.org/A5007579304', 'https://openalex.org/A5084818529', 'https://openalex.org/A5039432822', 'https://openalex.org/A5063472572', 'https://openalex.org/A5052190441', 'https://openalex.org/A5084502533']"
Graphene Biointerface for Cardiac Arrhythmia Diagnosis and Treatment,2023-03-25,0,2023-03-25,2023,3,Neuroscience,Cellular and Molecular Neuroscience,"['Neuroscience and Neural Engineering', 'Advanced Sensor and Energy Harvesting Materials', 'Advanced Memory and Neural Computing']",Igor R. Efimov,"['Ning Liu', 'Zhiyuan Chen', 'Deji Akinwande', 'Igor R. Efimov']","['https://openalex.org/A5035668823', 'https://openalex.org/A5100438506', 'https://openalex.org/A5063313700', 'https://openalex.org/A5001025616']"
Awareness and Use of ChatGPT and Large Language Models: A Prospective Cross-sectional Global Survey in Urology,2023-11-04,0,2023-11-04,2023,11,Medicine,Health Informatics,"['Artificial Intelligence in Healthcare and Education', 'Healthcare cost, quality, practices']",Michael Eppler,"['Michael Eppler', 'Severin Rodler', 'Enrico Checcucci', 'Juan Gómez Rivas', 'Stefano Puliatti', 'Alessandro Veccia', 'Jeremy Yuen‐Chun Teoh', 'Bhaskar K. Somani', 'André Luís de Castro Abreu', 'Francesco Porpiglia', 'Inderbir S. Gill', 'Giovanni Cacciamani']","['https://openalex.org/A5022334478', 'https://openalex.org/A5058255705', 'https://openalex.org/A5029580242', 'https://openalex.org/A5025441151', 'https://openalex.org/A5082997583', 'https://openalex.org/A5084824445', 'https://openalex.org/A5069174563', 'https://openalex.org/A5020657630', 'https://openalex.org/A5090012714', 'https://openalex.org/A5032156511', 'https://openalex.org/A5047742848', 'https://openalex.org/A5062586182']"
